<?xml version="1.0" encoding="UTF-8"?>
<VirtualCollection xmlns:xsi="http://www.w3.org/2001/XMLSchema-instance"
    xsi:noNamespaceSchemaLocation="VirtualCollection.xsd">
    <Type>extensional</Type>
    <Name>Test Collection 1</Name>
    <Description>Test Description</Description>
    <CreationDate>2009-12-31</CreationDate>
    <Creators>
        <Creator>
            <Name>Joe User</Name>
            <Email>joe.user@example.com</Email>
            <Organisation>Example Organization</Organisation>
        </Creator>
        <Creator>
            <Name>Jane User</Name>
            <Email>jane.user@example.com</Email>
            <Organisation>Example Organization</Organisation>
        </Creator>
    </Creators>
    <Purpose>sample</Purpose>
    <Reproducibility>untended</Reproducibility>
    <ReproducibilityNotice>Unmaintaned test collection.</ReproducibilityNotice>
    <Keywords>
        <Keyword>test</Keyword>
        <Keyword>unmaintained</Keyword>
    </Keywords>
    <Resources>
        <Resource>
            <ResourceType>Metadata</ResourceType>
            <ResourceRef>http://hdl.handle.net/1839/00-0000-0000-0005-671C-C</ResourceRef>
        </Resource>
        <Resource>
            <ResourceType>Metadata</ResourceType>
            <ResourceRef>http://hdl.handle.net/1839/00-0000-0000-0006-671C-C</ResourceRef>
        </Resource>
        <Resource>
            <ResourceType>Metadata</ResourceType>
            <ResourceRef>http://hdl.handle.net/1839/00-0000-0000-0007-671C-C</ResourceRef>
        </Resource>
    </Resources>
</VirtualCollection>
